{
  "mapping_version": "1.0.0",
  "mapping_id": "lbmap_op_0001",
  "provider_id": "PRV_ALPHA",
  "entity_type": "operator",
  "source_native_id": "op-77",
  "source_label": "Aurora Books Feed",
  "canonical_id": "lbop_0001",
  "status": "active",
  "created_at": "2027-02-01T09:00:00Z",
  "decision_basis": "governed_registry_entry",
  "evidence_reference": "governance/registry/operators#lbop_0001"
}
