{
  "mapping_version": "1.0.0",
  "mapping_id": "lbmap_ev_0001",
  "provider_id": "PRV_ALPHA",
  "entity_type": "event",
  "source_native_id": "evt-55321",
  "source_label": "Violet FC v Marigold United",
  "canonical_id": "lbev_000001",
  "status": "active",
  "created_at": "2027-03-01T08:00:00Z",
  "decision_basis": "governed_registry_entry",
  "evidence_reference": "governance/registry/events#lbev_000001"
}
